isEdited,userName,title,review,date,rating,app_name,app_id,developerResponse
False,mzindl,Nicht unterstütztes Fahrzeug,"Leider kann ich die neue App nicht nutzen, da mein Countryman JCW nicht unterstützt wird. Die alte App konnte es.",2021-07-04 12:16:25,1,mini,1519459056,"{'id': 23903920, 'body': ""Hi 'mzindl'! Danke für Dein Feedback! Die MINI App ist in der Tat für Fahrzeuge optimiert, die nach 03/2018 mit der Sonderausstattung ConnectedDrive Services (SA 6AK)und Remote Services (SA 6AP) produziert worden sind. Die\xa0Anzeige der\xa0Fahrzeugdaten\xa0via USB oder Bluetooth für\xa0Fahrzeuge, die diese Voraussetzungen nicht erfüllen,\xa0folgt\xa0in künftigen Releases der MINI App. - MINI App Support Team\r\n"", 'modified': '2021-07-13T11:45:07Z'}"
False,Exminifan,Schlechte App für Minis vor 2018,"Sämtliche Funktionen die man mit der alten App nutzen konnte, sind nicht mehr verfügbar.
Katastrophal.",2021-04-20 14:34:09,1,mini,1519459056,
False,BSPotsdam,Passt zur Software des Fahrzeugs - leider,"Die App ist genau so Fehler behaftet, wie die Software des Fahrzeugs. Da müssen in erster Linie die Praktikanten am Werk gewesen sein.",2021-07-24 19:48:37,1,mini,1519459056,
False,Lira64,Kein Support für meinen Mini mehr,Die App bekommt erst dann mehr als 1 Stern wenn mein Auto damit auch kompatibel ist…,2021-06-23 10:17:42,1,mini,1519459056,
False,Gaviskonn,Kein Fahrzeugdaten,Die App zeigt kein Fahrzeugdaten obwohl die Ausstattung SA 6MN vorhanden ist. Mein Mini ist von 2017. Das was hier der Entwickler schreibt/antwortet stimmt nicht,2021-08-04 16:54:00,1,mini,1519459056,"{'id': 24409707, 'body': 'Hi! Die MINI App ist für Fahrzeuge ab 03/2018 optimiert. Mit der aktuellen Version ist nun die Anzeige der Fahrzeugdaten via USB oder Bluetooth für Fahrzeuge zwischen 2012 und 03/2018 mit der Sonderausstattung “MINI Connected” (SA 6NM) für MINIs ohne SIM-Karte verfügbar. Sollte das Problem weiterhin auftreten, melde es uns über ""Feedback senden"" im Menü ""Profil"". In künftigen Releases folgt diese Anzeige der Fahrzeugdaten für weitere Fahrzeuge. - MINI App Team\r\n', 'modified': '2021-08-09T20:43:54Z'}"
False,hannigamemsp,Funktion,"Ist ein Witz das der mini mit Mini Connected Xl
Von 2017 nicht mehr funktioniert.
Musste man vor ein paar Jahren teuer bezahlen und jetzt einfach 
Aus dem Programm geschmissen worden",2022-02-01 17:45:21,1,mini,1519459056,
False,Elektro73,Menüführung super🤓,"Guter Aufbau, man findet sich super zurecht.",2022-04-16 13:28:23,5,mini,1519459056,
False,PPL Lerner,Nur 1 Fahrer pro Mini,"Der Mini kann zwar mehrere Nutzer verwalten, nicht aber die App. Es kann nur 1 Nutzer eine App installieren. Die anderen müssen ohne Remote Funktionen auskommen. 

Klarer Fall von „schlecht gemacht nicht mitgedacht!“",2022-04-27 15:51:21,1,mini,1519459056,"{'id': 29516200, 'body': ""Hi 'PPL Lerner'! Danke für Dein Feedback! Aktuell kann ein Fahrzeug in der Tat immer nur mit einer MINI ID verbunden sein, aber mehrere Personen können die MINI App auf unterschiedlichen Smartphones mit demselben Konto nutzen. Die Multi-User Funktionalität für dasselbe Fahrzeug in der MINI App folgt allerdings in künftigen Releases. - MINI App Support Team\r\n"", 'modified': '2022-05-02T17:06:42Z'}"
False,Dr. Glatze,Plöd,App funktioniert irgendwie nicht. Soll alle Cokies zu lassen. Hallo es werden nur die cokies vor meinem Mund blockiert um nicht dich zu werden. Naja ist bestimmt ne nette App wenn de funktioniert. Hab sogar den pop-up Blocker aus gemacht.,2021-04-24 09:06:11,1,mini,1519459056,"{'id': 22516724, 'body': ""Hi 'Dr. Glatze'! Wir bedauern, dass Du aktuell Probleme bei der Nutzung der MINI App hast. Anderen Nutzern hat Folgendes geholfen: Checke erneut ob Du Cookies aktiviert hast und aktiviere sie gegebenenfalls. Beende anschließend Deinen Browser und starte ihn erneut manuell. - MINI App Support Team\r\n"", 'modified': '2021-04-28T17:38:59Z'}"
False,Ipadtollfinder,ärgerlich,"auch diese vergißt vergisst das Passwort. Aber egal ist eh mein letzter Mini/BMW, die Technik ist einfach 1-2 Generation zu rückständig. Und was mein Hybrid verbraucht, spottet jeder Beschreibung. Dafür ist er aber für 220 PS besonders lahm. Das passt dann wieder zur App, ist halt ein stimmiges Gesamtkonzept.",2021-11-29 07:02:34,1,mini,1519459056,
False,enttäuschter_Sparkassen-Kunde,Ein Stern ist noch Zuviel.,Funktioniert überhaupt nicht. Uneingeschränkt unempfehlenswert. Allerdings interessiert es bei Mini auch niemanden. Angerufen wird nur um ein neues Auto zu verkaufen.,2020-09-11 13:07:09,1,mini,1519459056,
False,Ayers Air,AGB können nicht geladen werden,"Leider kann ich die App gar nicht benutzen, da er immer wieder „Daten nicht verfügbar“ anzeigt. Schade :-(",2022-01-25 12:19:54,1,mini,1519459056,"{'id': 27790628, 'body': ""Hi 'Ayers Air'! Danke für Dein Feedback! Wir bedauern, dass Du aktuell Probleme bei der Nutzung der MINI App hast. Aus Deiner Fehlermeldung vermuten wir, dass Dein Account oder Heimatmarkt nicht korrekt ist. Kontaktiere die MINI Deutschland Kundenbetreuung unter +49 89 1250-16012, damit wir Deine Accountsettings prüfen und Deinem Profil einen Heimatarkt zuweisen können. - MINI App Support Team\r\n"", 'modified': '2022-02-01T16:47:19Z'}"
False,FGABL,Mini Connected für ältere Fahrzeuge,"Ich verstehe zwar dass die App und deren Features nicht mit älteren Fahrzeugen funktioniert, aber warum wurde die „Mini Connected“ App deaktiviert? Diese hätte für die älteren Fahrzeuge ja noch einen Mehrwert geliefert, so hat man nun nichts mehr…",2021-07-08 18:56:52,1,mini,1519459056,
False,Andreas Hofem,Stürzt ab,"Mini Clubman John Works Cooper 2005 - eure Apps haben noch nie funktioniert. 
Wo sind die versprochenen Sportinstrumente auf meinem Display ? Katastrophe…..

Bei der Verbindung stürzt die App ab.",2021-08-17 20:34:28,1,mini,1519459056,
False,Bob_OC,Warum,"Super Kundenfreundlichkeit (Sarkasmus)! Neue App ist erst für Fahrzeuge ab 2018 und die alte Version (Mini Connected) wird Ende Juni eingestellt!!!!!!!!
So kann man seine Wertschätzung seinen Kunden gegenüber zeigen…….!
Vielen Dank auch!!",2021-05-14 06:26:19,1,mini,1519459056,
False,Bilel.S,Fehler nicht unterstütztes Fahrzeug!!!,"Mit der bisherigen App war alles OK. Jetzt mit dem Update soll wohl mein Fahrzeug nicht mehr unterstützt und benötige eine “zusätzliche Hilfe” vom der Kundenbetreuung. 
Sehr enttäuscht!",2021-07-11 16:51:32,1,mini,1519459056,"{'id': 23930515, 'body': ""Hi 'Bilel.S'! Danke für Dein Feedback! Wir bedauern, dass Du Probleme hast, Deinen MINI mit Deiner MINI ID in der MINI App zu verbinden. Dein Fahrzeug muss nach 03/2018 mit der Sonderausstattung ConnectedDrive Services (SA 6AK)und Remote Services (SA 6AP) produziert sein. Mit der aktuellen Version der MINI App ist nun die Anzeige der Fahrzeugdaten via USB oder Bluetooth für Fahrzeuge verfügbar, die zwischen 2012 und 03/2018 produziert worden sind und über die Sonderausstattung “MINI Connected” (SA 6NM) verfügen. Die Anzeige der Fahrzeugdaten via USB oder Bluetooth für Fahrzeuge, die diese Voraussetzungen nicht erfüllen, folgt in künftigen Releases. - MINI App Support Team"", 'modified': '2021-07-14T17:16:43Z'}"
False,Game_Survival,FindMate Unterstützung gestrichen,"Man wird zur Benutzung der neuen App gezwungen, in der kein FindMate Support vorhanden ist. Besonders dreist ist, dass die Dinger weiterhin verkauft werden.",2021-06-28 13:11:38,1,mini,1519459056,
False,lisa9595,nicht nachgedacht!,"Ich bin sehr enttäuscht. Von einer neuen App, die eine bereits vorhandene App ablöst, hab ich mehr erwartet. Obwohl ich ein F57 fahre ist die App nicht nutzbar, da sie nicht alle Seriennummer erfasst / erkennt. 

Hier sollte dringend dran gearbeitet werden!

Die vorherige App habe ich geliebt. Musste das Navi nicht mehr händig programmieren, wusste ob irgendwelche Fenster offen stehen.. und vor Terminen konnt ich sogar ohne im Auto zu sitzen die nächste Tankstelle miteinplanen, da ich wusste wie viel Reichweite ich noch habe. 
Jetzt funktioniert gar nichts mehr. 😞 sehr sehr schade.",2021-09-20 05:02:55,1,mini,1519459056,"{'id': 25298247, 'body': 'Hi Lisa! Wir bedauern, dass Du Probleme hast, Deinen MINI mit Deiner MINI ID in der MINI App zu verbinden. Die MINI App ist für Fahrzeuge optimiert, die nach 03/2018 mit der Sonderausstattung ConnectedDrive Services (SA 6AK)und Remote Services (SA 6AP) produziert worden sind. Mit der aktuellen Version der MINI App ist nun die Anzeige der Fahrzeugdaten via USB oder Bluetooth für Fahrzeuge verfügbar, die zwischen 2012 und 03/2018 produziert worden sind und über die Sonderausstattung “MINI Connected” (SA 6NM) verfügen. - MINI App Support Team\r\n', 'modified': '2021-09-24T10:20:58Z'}"
False,merline67,Geht gar nichts mehr,"Die alte „Mini connected „ App war ganz gut, geht aber inzwischen nicht mehr.. die neue geht auch nicht, weil ein 5 Jahre alter Mini Cooper zu alt ist für die Entwickler… sehr enttäuschend …",2021-11-16 17:23:27,1,mini,1519459056,
False,stratkom,MINI ID,"Ich kann die App noch nicht bewerten, weil wir noch auf unseren neuen MINI SE warten und die App noch nicht nutzen können. ABER: Warum ist die MINI ID für diese App nicht auch für MINI Charging App nutzbar? Wir haben mehrfach versucht, dieselbe IB dort einzugeben. Antwort: Die Email-Adresse wird bereits genutzt.",2021-06-23 11:36:39,1,mini,1519459056,
True,Knolli68,Funktioniert nicht 🤷🏼‍♀️,"Leider lässt sich mein Mini nicht hinzufügen 😫

Nach Eingabe der FIN braucht mein Mini zusätzliche Unterstützung vom Kundendienst. Die sagten, es geht nicht. Mit einem F57 Baujahr 2017 🤦🏼‍♀️

Bei der alten App musste ich einfach über USB verbinden und schon war der Mini drin. So ein Schrott 😩

Lieber MINI App Support, 
danke für die Antwort. Das bringt mich leider keinen Schritt weiter. Warum wird die Verbindung der MINI App mit meinem MINI über USB oder Bluetooth aktuell nicht unterstützt ??? Bei der MINI Connected App funktioniert das doch 🙄 Also werde ich diese weiter nutzen und die neue App wandert dahin, wo sie hingehört. In den Papierkorb 🗑",2020-10-27 12:24:35,1,mini,1519459056,"{'id': 18708200, 'body': ""Hallo 'Knolli68'! Wir bedauern, dass Du Probleme hast, Deinen MINI in der MINI App hinzuzufügen. Dein Fahrzeug muss nach 03/2018 mit der Sonderausstattung ConnectedDrive Services (SA 6AK) produziert sein. Die Verbindung der MINI App mit Deinem MINI über USB oder Bluetooth wird aktuell nicht unterstützt. - MINI App Support\r\n"", 'modified': '2020-10-27T12:24:35Z'}"
False,noppeck,Für mich ein nogo,"Die neue Mini App kann ja nix, wenn diese App noch in Entwicklung steht, warum schmeißt ihr dem Minifahrer so einen Dreck vor die Füsse , Mit freundlichen Grüßen",2020-08-31 13:19:08,1,mini,1519459056,
False,Mini-Fahrer,Verschlimmbessert,Schlechter als die vorherige MINI App. Wo sind z.B. die Verbrauchswerte geblieben?,2021-07-07 17:16:13,1,mini,1519459056,
False,ReyPat,Nicht brauchbar,"Schade, dass man die Unterstützung für älteren Minis (älter als 3 Jähre) aufgegeben hat und die alte App ohne Ersatz gestrichen hat….",2021-11-29 13:33:38,1,mini,1519459056,
False,BigBang24,Stürzt immer noch ab,"Mini/BMW schaff es einfach nicht mit der App auch die älteren Mini-Modelle zu unterstützen, für die die Kunden damals extra bezahlt haben.

Nach dem Starten und Eingabe der Seriennummer meldet die App:

„Sie können Ihr Fahrzeug weiterhin
hinzufügen und Ihre Fahrzeugdaten
über USB/Bluetooth mit der App
synchronisieren.“

Das funktioniert, mein Mini-S-Cabrio wird mit der richtigen Farbe usw angezeigt - und dann stürzt die App ab.

Sehr schwache Leistung und echt eine Unverschämtheit die alte App einfach deaktivieren und die neue nicht mehr kompatibel zu machen.

Ob ich mir nochmal einen neuen Mini kaufen werde?",2022-04-06 10:41:45,1,mini,1519459056,
False,mini4abcd,Keine Aussage zu Qualität und Funktion möglich,Unverständlichlicherweise ist jeder weitere Fahrer von der Nutzung der App ausgeschlossen.,2022-01-23 09:50:41,1,mini,1519459056,
False,iglfi egg cuckcjx,Immer besser,App wird immer besser,2021-04-21 12:33:37,5,mini,1519459056,
False,Schneezickchen,sehr schlecht,"die alte app war viel besser! mein fahrstil wurde mit sternen bewertet, der durchschnittsverbrauch angezeigt…
jetzt übernaimmt die app leider nicht einmal mehr die ladeeinstellungen 🙁
da steckt noch viel nachholbedarf drin",2021-10-13 18:41:49,1,mini,1519459056,
False,Gewichtiger,Keine Funktion mehr,"Seit dem letzten Update funktioniert die App auf dem iPhone nicht mehr.
Ich soll mich neu anmelden.
Dann kommt die Infos, dass ich am Browser die Cookies einschalten soll.
Eine Cookie-Auswahl steht aber nicht zur Verfügung.
Ich denke nicht daran. Bisher ging es auch ohne.
Welch ein Rückschritt im Datenschutz. Traurig !",2022-04-14 19:18:20,1,mini,1519459056,"{'id': 29286885, 'body': ""Hi 'Gewichtiger'! Danke für Dein Feedback! Wir bedauern, dass Du dieses Problem mit der MINI App hast. Kontaktiere die MINI Deutschland Kundenbetreuung, damit wir Dir weiter helfen können. Du erreichst uns unter +49 89 1250-16012. - MINI App Support Team\r\n"", 'modified': '2022-04-20T14:01:16Z'}"
False,LeonR77,Cooles Upgrade,"Cooles Upgrade zur Connected App. Bin gespannt, ob da noch mehr kommt.",2020-07-30 04:58:13,5,mini,1519459056,"{'id': 17125738, 'body': 'Hallo Leon! Ja, da kommt noch einiges! Über neue Features informieren wir immer in den App Release Notes. - MINI App Support Team', 'modified': '2020-08-06T15:31:39Z'}"
False,nowisu,"Gute App, bis auf den Klimatimer","Leider scheint es nicht möglich zu sein, die Standklimatisierung für eine EINMALIGE Abfahrtzeit zu programmieren. 

Beim Mini Countryman SE überträgt sich die Programmierung auf den Folgetag und verschwendet Tag für Tag Strom. 

Einzige Abhilfe ist das Deaktivieren der Ladezeit und des Lade- und Klimatimers mit erneutem Senden ans Fahrzeug. 

Das geht besser!",2022-02-07 06:18:59,2,mini,1519459056,"{'id': 28043427, 'body': ""Hi 'nowisu'! Danke für Dein Feedback! Wir leiten Deine Anregung an unser Produktteam weiter. - MINI  App Support Team\r\n"", 'modified': '2022-02-14T17:24:05Z'}"
False,iLeoFFM,Lade & Klimatimer funktioniert nicht bei Cooper SE,"Das Ticket liegt bei der Hotline, aber keine Reaktion. Wäre toll, wenn die App auch mit dem Auto funktionieren würde. Bei älteren SE geht es ja auch",2022-01-18 07:55:17,1,mini,1519459056,
False,Sind zu kurz,Was ist los mit BMW?,"Ist mein Mini aus 2013 schon nicht mehr wert eine funktionierende App zu bekommen?
Schämt euch!",2021-10-30 12:12:10,1,mini,1519459056,
False,Christian-M.,Anmeldung nicht möglich,"Wow ! 
Das es sowas noch gibt ?
Gestern unseren neuen Mini abgeholt - und dann gibt es ja diese MINI App - Wow - cool.
Dann wollen wir mal - registrieren ✅
Bestätigungsmail ?? ❌
Auch nicht im Spam 
2 Stunden später mal auf Paaswort vergessen geklickt - Mail kommt schreibt man dort.
Mail ???? ❌
Im Spam auch nichts. Anmeldung nicht möglich 
Ist das euer Ernst ?? Und das in solch einem Konzern ??

Dann das eigentliche Wow für 🤔 - Ja - für was ? Ach ja - für nichts 😀",2021-04-30 10:44:17,1,mini,1519459056,
False,Diddi1952,Frustrierend,"Die App war noch nie gut, dass man sie aber mit einem „älteren“ Cooper S mit TOP Ausstattung gar nicht mehr nutzen kann ist ein Skandal. Warum habe ich für das Connected Paket bezahlt?",2022-01-17 18:34:53,1,mini,1519459056,
False,MBB+5,Nichts für E-Antrieb,"Kartendienst mit Tankstellen, nicht mit Ladesäulen... Ernsthaft??? Und wo ist die Seite „edrive“ geblieben? Das war toll, bitte nachholen, bis die Connected abgeschaltet wird...",2021-04-12 20:51:02,1,mini,1519459056,"{'id': 22402989, 'body': 'Hi \'MBB+5\'! Danke für Dein Feedback! Wir bedauern, dass Du kürzlich Probleme mit der Anzeige der Ladesäulen im Menü ""Karte"" der MINI App hattest. Wir hatten an diesem Tag einen temporären Fehler, der mittlerweile behoben wurde! Sollte das Problem bestehen, melde es uns im Menü ""Profil"" über ""Feedback senden. - MINI App Support Team\r\n', 'modified': '2021-04-22T17:08:52Z'}"
False,nc4972,Registrierung nicht möglich,Keine Hilfe durch Service,2020-09-11 06:04:41,1,mini,1519459056,
False,ystapic,Looking fresh!,Super new new design and much simplified user experience - I like the new profile tab! 🚗🚗🚗,2020-07-27 11:56:25,5,mini,1519459056,
False,Matthias Schmid,Mini App,"Totaler Blödsinn
Ich konnte meine App bisher nutzen 
Jetzt muss ich mich registrieren lassen bei Mini 
MeinenDaten behalte ich f mich!

Matthias",2021-12-28 17:19:19,1,mini,1519459056,
False,K. J. M. A.,Complicated,"The new MINI App has more features than MINI Connected. However, it’s much more complicated. For example in MINI connected you can easily synchronize the app with the car Navi just by writing the address on the app then it’s automatically on the car Navi without complication. With the new MINI App it takes my more longer due to the unnecessary steps by sending the address to the car, waiting until you get the message then open the message inbox to confirm the address then.. then.. long process compared to the simplicity on the MINI Connected. 👎🏼",2021-06-06 09:00:12,1,mini,1519459056,"{'id': 23319982, 'body': ""Hi 'K. J. M. A.'! Thank you for your feedback! We will forward your improvement suggestions to our product team. - MINI App Support Team\r\n"", 'modified': '2021-06-11T04:55:45Z'}"
False,Savsinger,Very Poor Development Mini/ BMW,"The app does not work with pre 2018 models as it doesn’t accept the VIN number, and to top it MINI have deleted the old app from the App Store. So if you have recently purchased a 2017 model .... tough luck. This is not what one expects from BWM .... maybe Vorsprung Durch Technik is the better way to go. Or buy a new Mini just for the app ..... I think not !",2021-06-09 05:01:35,1,mini,1519459056,"{'id': 23745332, 'body': 'Hi \'Savsinger\'! Thank you for your feedback! Currently, the MINI App is indeed optimized for vehicles which have been produced after 03/2018 with a Connected package including the option „ConnectedDrive Services“ (SA 6AK) and ""Remote Services"" (SA 6AP). We are continuously working on improving the MINI App to enable more features and the possibility to check your vehicle data via USB/Bluetooth in upcoming releases, also for vehicles produced prior to March 2018. - MINI App Support Team\r\n', 'modified': '2021-07-05T08:36:08Z'}"
False,philippminidd,✌🏻,"Super Fresh 🥳 

I Look forward to additional gimmicks.",2020-07-28 07:15:52,5,mini,1519459056,
False,Maxitoby81,Top Modern,Schickes Layout und gute Funktion,2020-07-27 19:17:03,5,mini,1519459056,
False,Albartus,Appalling,"Thank you Mini for forgetting about your customers that are older than 3 years! Obviously with Mini/BMW the older customer means nothing anymore, very very poor.",2021-07-04 10:21:25,1,mini,1519459056,"{'id': 23903917, 'body': 'Hi \'Albartus\'! Thank you for your feedback! Currently, the MINI App is indeed optimised for vehicles with a production date from 03/2018 onwards and\xa0a\xa0Connected\xa0package\xa0including\xa0the\xa0option\xa0„ConnectedDrive\xa0Services“ (SA 6AK) and ""Remote Services"" (SA 6AP). In future releases of the MINI App, vehicle data will also be displayed via USB or Bluetooth for vehicles that do not meet this requirement. - MINI App Support Team\r\n', 'modified': '2021-07-13T11:44:52Z'}"
False,amitbeniwal,Countryman,Love my new countrymen 🤘🤘🇮🇳,2021-08-13 18:23:39,5,mini,1519459056,
False,LFC 4TUNE,Mini app,"VIN doesn’t work, what’s the point
3 year old Cooper",2021-06-10 18:10:19,1,mini,1519459056,"{'id': 23386824, 'body': 'Hi \'LFC 4TUNE\'! We regret that you are experiencing problems adding your vehicle to your MINI ID in the MINI App! To add your vehicle to the MINI App it must have been produced after 03/2018 with\xa0a\xa0Connected\xa0package\xa0including\xa0the\xa0option\xa0„ConnectedDrive\xa0Services“ (SA 6AK) and ""Remote Services"" (SA 6AP). If so, contact MINI customer service at  +49 89 1250-16012 for further assistance. - MINI App Support Team', 'modified': '2021-06-15T06:37:33Z'}"
False,rob.berlin,so much fun,finally including Amazon Alexa and clinate timer. Thx,2021-04-07 10:34:08,5,mini,1519459056,
True,shroudy86,Nachhaltigkeit Fehlanzeige,"Bei MINI ist man der Ansicht, dass ein Auto von 03/2017 schon „zu alt“ ist um von der neuen App unterstützt zu werden. Bis vor einem Jahr war das noch anders, bis man sich dann entschlossen hat, die damals noch wunderbar funktionierende App zu entfernen. Erst wird einem MINI Connected als teure Zusatzfunktion verkauft und dann wird diese Funktion ersatzlos gestrichen.

Traurig auch: Negative Bewertungen werden hier regelmäßig gelöscht. Tja, so kann man sein eigenes Versagen auch wunderbar vertuschen.",2022-06-01 20:33:40,1,mini,1519459056,"{'id': 23745243, 'body': ""Hi 'shroudy86'! Danke für Dein Feedback! Die MINI App ist aktuell in der Tat für Fahrzeuge mit Produktionsdatum ab 03/2018 optimiert, die über die technische Ausstattung verfügen, regelmäßige Updates zum Fahrzeugstatus zu senden. Die\xa0Anzeige der\xa0Fahrzeugdaten\xa0via USB oder Bluetooth für\xa0Fahrzeuge, die diese Voraussetzungen nicht erfüllen,\xa0folgt\xa0in künftigen Releases. - MINI App Support Team\r\n"", 'modified': '2022-06-01T20:33:40Z'}"
False,JuanMG,Die Mini App ist Minimalistisch,"Hallo, mein Mini SE ist 10/2021. Die MINI App ist wie deren Funktionen sind minimalistisch wie auch deren MINI Cooper Minimalism Analyser Display mit Aquarium. How happy is your Fish?? … ist nicht hilfreich! Andere Hersteller haben zahlen, Daten und Fakten die helfen Reichweite zu erreichen und zu optimieren. Nicht einmal die Ladung kann man begrenzen, z.B bei 88% wäre sicherlich ein Vorteil und erhöht die Lebensdauer, von 100 % wird abgeraten. Warum macht es BMW & MINI so kompliziert/ anders. Hier ist definitiv Handlungsbedarf",2022-05-04 08:35:00,2,mini,1519459056,"{'id': 29596788, 'body': 'Hi Juan! Danke für Dein Feedback! Der Funktionsumfang der MINI App ist abhängig vom Produktionsdatum Deines MINI und den gebuchten Sonderausstattungen. Weitere Funktionen, inkl. zusätzlicher Daten und Fakten zu vergangenen Fahrten, Reichweite und Verbrauch, folgen in künftigen Releases der MINI App. Wir informieren über neue Funktionen immer in den App Release Notes. - MINI App Support Team\r\n', 'modified': '2022-05-06T13:04:36Z'}"
False,Teufel2019,Mini Cooper F54  2015,"Ich kann diese App nicht nutzen. 
Mit der anderen App ging es wunderbar. ??",2021-10-24 06:02:21,1,mini,1519459056,"{'id': 25932572, 'body': 'Hi! Wir bedauern, dass Du Probleme hast, Deinen MINI mit Deiner MINI ID in der MINI App zu verbinden. Die MINI App ist für Fahrzeuge optimiert, die nach 03/2018 mit der Sonderausstattung ConnectedDrive Services (SA 6AK)und Remote Services (SA 6AP) produziert worden sind. Mit der aktuellen Version der MINI App ist nun die Anzeige der Fahrzeugdaten via USB oder Bluetooth für Fahrzeuge verfügbar, die zwischen 2012 und 03/2018 produziert worden sind und über die Sonderausstattung “MINI Connected” (SA 6NM) verfügen. Die Anzeige der Fahrzeugdaten via USB oder Bluetooth für Fahrzeuge, die diese Voraussetzungen nicht erfüllen, folgt in künftigen Releases. - MINI App Support Team\r\n', 'modified': '2021-10-27T17:20:18Z'}"
False,Deconett,1.5.2 ist immer noch nicht für Fahrzeuge vor 2018,App unterstützt keine Minis vor 2018. Alte App wurde abgeschafft. Was machen nun alle die einen Mini von 2012-2018 haben? Wir können die Funktionalität nicht benutzen obwohl wir die Option bezahlt haben. Mir ist zum Beispiel die Funktion zum Sender der Adressen an das Navi am wichtigsten. Die Funktionalität könnte man in Null  Komma nichts implementieren… wurde aber nichts gemacht. Schade. Ich werde keinen Mini mehr kaufen,2021-08-02 13:40:51,1,mini,1519459056,"{'id': 24358065, 'body': ""Hi 'Deconet'! Danke für Dein Feedback! Die MINI App ist in der Tat für Fahrzeuge optimiert, die nach 03/2018 mit der Sonderausstattung ConnectedDrive Services (SA 6AK) und Remote Services (SA 6AP) produziert worden sind. Mit der aktuellen Version der MINI App ist nun die Anzeige der Fahrzeugdaten via USB oder Bluetooth für Fahrzeuge verfügbar, die zwischen 2012 und 03/2018 produziert worden sind und über die Sonderausstattung “MINI Connected” (SA 6NM) verfügen. - MINI App Support Team"", 'modified': '2021-08-06T14:02:58Z'}"
False,Ztztztztztztztzorororor,Nutzlos,"Mein Mini JCW EZ01/2018 lässt sich mit der App nicht mehr verbinden. Anrufe bei der Hotline ergeben das Auto ist 2 Monate zu alt. Ein Witz, wofür habe ich ein großes navi und connected XL eingebaut? So vergrault man Kunden, ein Stern ist noch zuviel",2021-07-27 07:34:57,1,mini,1519459056,"{'id': 24257554, 'body': 'Hi! Danke für Dein Feedback! Die MINI App ist in der Tat für Fahrzeuge optimiert, die nach 03/2018 mit der Sonderausstattung ConnectedDrive Services (SA 6AK)und Remote Services (SA 6AP) produziert worden sind. Mit der aktuellen Version der MINI App ist nun die Anzeige der Fahrzeugdaten via USB oder Bluetooth für Fahrzeuge verfügbar, die zwischen 2012 und 03/2018 produziert worden sind und über die Sonderausstattung “MINI Connected” (SA 6NM) verfügen. Die Anzeige der Fahrzeugdaten via USB oder Bluetooth für Fahrzeuge, die diese Voraussetzungen nicht erfüllen, folgt in künftigen Releases. - MINI App Support Team\r\n', 'modified': '2021-08-02T09:41:23Z'}"
False,Jochen-51,Seit Update 13.07.2021  unbrauchbar,"Nach dem Update wird mein registrierter Mini Cooper SE nicht mehr erkannt; auch eine neue Registrierung des Fahrzeugs durch Eingabe der VIN klappt nicht !
Updates sollten vor Veröffentlichung gründlich getestet werden.",2021-07-13 21:29:33,1,mini,1519459056,
